page,url,page_title,meta_description,H1,word_count,links_internos_sugeridos,notas
Home,/,MAC Paving | Family-Owned Paving Contractors in North Jersey,"Family-owned MAC Paving and Sealcoating LLC delivers driveway paving, asphalt resurfacing, sealcoating, extensions, and Belgium block edging solutions across Passaic, Bergen, Morris, Essex, Hudson, Union, Middlesex, Somerset, and Sussex counties.",North Jersey Paving Contractors,145,Driveway paving service overview → `/services/driveway-paving-nj/` | Sealcoating and maintenance services → `/services/sealer/` | Belgium block edging → `/services/belgium-blocks/` | Book a consultation → `/contact/`,Ensure Google Analytics/Tag Manager uses the canonical HTTPS domain. | No hreflang needed; English is the only language served today.
Services,/services/,North Jersey Paving Services | MAC Paving,"Explore driveway paving, asphalt resurfacing, sealcoating, crack repair, and Belgium block edging delivered by MAC Paving across Passaic, Bergen, Morris, Essex, Hudson, Union, Middlesex, Somerset, and Sussex counties.",MAC Paving and Sealcoating Services,131,Driveway paving category → `/services/driveway-paving-nj/` | Sealer services → `/services/sealer/` | Belgium block borders → `/services/belgium-blocks/` | Contact for estimates → `/contact/`,Encourage caching of service card images for Core Web Vitals. | Reconfirm canonical ingestion by analytics tools after deployment.
Driveway Paving NJ,/services/driveway-paving-nj/,Driveway Paving Services NJ | MAC Paving,"Owner-led MAC Paving rebuilds residential, commercial, and private driveways across Passaic, Bergen, Morris, Essex, Hudson, Union, Middlesex, Somerset, and Sussex counties with installations, resurfacing, replacements, and extensions.",Driveway Paving Services in North Jersey,160,Installation details → `/services/driveway-paving-nj/paving-installation-nj/` | Resurfacing details → `/services/driveway-paving-nj/paving-resurfacing-nj/` | Replacement services → `/services/driveway-paving-nj/paving-replacement-nj/` | Sealcoating programs → `/services/sealer/sealcoating/`,"Highlight 15+ years of experience consistently across hero, About, and metadata. | Maintain HTTPS canonical for analytics and SEO consistency."
Driveway Paving Installation,/services/driveway-paving-nj/paving-installation-nj/,Driveway Installation NJ | MAC Paving,"MAC Paving designs and installs new asphalt driveways for residential, commercial, HOA, and private properties across Passaic, Bergen, Morris, Essex, Hudson, Union, Middlesex, Somerset, and Sussex counties.",Driveway Paving Installation Built for North Jersey,112,Driveway resurfacing overview → `/services/driveway-paving-nj/paving-resurfacing-nj/` | Sealcoating protection → `/services/sealer/sealcoating/` | Contact scheduling → `/contact/`,Mention standard 15+ years of expertise; avoid promising specific warranties or timelines.
Driveway Resurfacing,/services/driveway-paving-nj/paving-resurfacing-nj/,Driveway Resurfacing NJ | MAC Paving,"MAC Paving resurfaces aging asphalt driveways and HOA roads with milling, structural repairs, and new overlays across Passaic, Bergen, Morris, Essex, Hudson, Union, Middlesex, Somerset, and Sussex counties.",Driveway Resurfacing That Extends Asphalt Life,100,Driveway replacement overview → `/services/driveway-paving-nj/paving-replacement-nj/` | Sealcoating and crack repair → `/services/sealer/crack-filling/` | Contact for estimates → `/contact/`,Clarify that resurfacing is contingent on base condition; avoid promising specific lifespans.
Driveway Replacement,/services/driveway-paving-nj/paving-replacement-nj/,Driveway Replacement NJ | MAC Paving,"MAC Paving removes failing asphalt, rebuilds stone bases, and installs new driveways for homes, HOAs, and private facilities across Passaic, Bergen, Morris, Essex, Hudson, Union, Middlesex, Somerset, and Sussex counties.",Full Driveway Replacement for Lasting Performance,104,Driveway extension service → `/services/driveway-paving-nj/paving-extension-nj/` | Sealcoating protection → `/services/sealer/sealcoating/` | Contact for scheduling → `/contact/`,Highlight that timelines depend on weather and permitting; provide ranges instead of guarantees.
Driveway Extension,/services/driveway-paving-nj/paving-extension-nj/,Driveway Extension NJ | MAC Paving,"Extend or widen your driveway with seamless asphalt tie-ins, parking pads, and apron upgrades delivered by MAC Paving across Passaic, Bergen, Morris, Essex, Hudson, Union, Middlesex, Somerset, and Sussex counties.","Driveway Extensions, Widenings & Parking Pads",103,Driveway paving overview → `/services/driveway-paving-nj/` | Belgium-block accents → `/services/belgium-blocks/` | Contact scheduling → `/contact/`,Specify that final scope depends on municipal approvals and property setbacks.
Belgium Blocks,/services/belgium-blocks/,Belgium Block Curbing & Aprons NJ | MAC Paving,"MAC Paving installs Belgium-block borders, aprons, curbing, and accents that pair with asphalt projects across North Jersey.","Belgium Block Borders, Aprons & Accents",96,Driveway installation → `/services/driveway-paving-nj/paving-installation-nj/` | Contact for design consult → `/contact/` | Service overview → `/services/`,Use “Belgium block” spelling consistently; avoid implying natural-stone sourcing specifics beyond granite.
Sealer Services,/services/sealer/,Sealcoating & Asphalt Repair NJ | MAC Paving,"MAC Paving protects asphalt driveways, parking lots, and private roads with sealcoating, crack filling, pothole repair, and line striping across North Jersey counties.","Sealcoating, Crack Repair & Line Striping",88,Sealcoating detail page → `/services/sealer/sealcoating/` | Crack filling detail page → `/services/sealer/crack-filling/` | Line striping detail page → `/services/sealer/line-striping/` | Contact form → `/contact/`,Mention drying recommendations but avoid promising specific cure times due to weather dependence.
Sealcoating,/services/sealer/sealcoating/,Sealcoating Services North Jersey | MAC Paving,"MAC Paving applies premium sealers, crack fillers, and optional sand additives to protect asphalt driveways, lots, and private roads throughout Passaic, Bergen, Morris, Essex, Hudson, Union, Middlesex, Somerset, and Sussex counties.",Sealcoating That Extends Asphalt Life,111,Crack filling → `/services/sealer/crack-filling/` | Line striping → `/services/sealer/line-striping/` | Driveway paving → `/services/driveway-paving-nj/`,Remind clients to keep vehicles off the surface until crews confirm reopening; avoid promising specific hours.
Crack Filling,/services/sealer/crack-filling/,Crack Filling & Asphalt Repair NJ | MAC Paving,"MAC Paving routes, cleans, and seals asphalt cracks to block water intrusion for residential, HOA, and commercial clients across North Jersey.",Crack Filling to Stop Water Damage,99,Sealcoating services → `/services/sealer/sealcoating/` | Driveway resurfacing → `/services/driveway-paving-nj/paving-resurfacing-nj/` | Contact scheduling → `/contact/`,Highlight that larger base failures may require patching or replacement—set expectations in copy.
Line Striping,/services/sealer/line-striping/,Line Striping & Pavement Markings NJ | MAC Paving,"MAC Paving refreshes or redesigns parking-lot striping, ADA stalls, directional arrows, and specialty markings for properties across North Jersey.",Parking-Lot Striping & Layout Updates,80,Sealcoating overview → `/services/sealer/sealcoating/` | Contact for scheduling → `/contact/` | Driveway paving (for property managers) → `/services/driveway-paving-nj/`,Mention compliance with ADA and fire-lane requirements without promising legal certification beyond our scope.
Contact,/contact/,Contact MAC Paving | Asphalt Paving Services NJ,"Reach MAC Paving and Sealcoating LLC for paving estimates, maintenance schedules, or emergency service across Passaic, Bergen, Morris, Essex, Hudson, Union, Middlesex, Somerset, and Sussex counties.",Contact MAC Paving and Sealcoating,92,Driveway paving overview → `/services/driveway-paving-nj/` | Sealcoating services → `/services/sealer/` | Service areas page → `/service-areas/`,Mention SSL-secured form submissions and remind visitors not to include payment info online.
About,/about/,About MAC Paving and Sealcoating LLC | North Jersey Paving Experts,"Learn how MAC Paving and Sealcoating LLC grew into a family-owned paving company serving Passaic, Bergen, Morris, Essex, Hudson, Union, Middlesex, Somerset, and Sussex counties for over 15 years.",Family-Owned Paving Rooted in North Jersey,108,Services overview → `/services/` | Driveway paving → `/services/driveway-paving-nj/` | Contact page → `/contact/`,Reinforce bilingual communication if applicable when content becomes available; currently single-language.
Service Areas,/service-areas/,Paving Service Areas | MAC Paving North Jersey,"MAC Paving and Sealcoating LLC serves Passaic, Bergen, Morris, Essex, Hudson, Union, Middlesex, Somerset, and Sussex counties with driveway paving, sealcoating, Belgium block edging, and maintenance.",North Jersey Counties We Serve,110,Driveway paving overview → `/services/driveway-paving-nj/` | Sealcoating services → `/services/sealer/sealcoating/` | Contact page → `/contact/`,Include Google Map embed coordinates and ensure analytics track map interactions (non-blocking requirement).
FAQs,/faqs/,Paving FAQs | MAC Paving North Jersey,"Answers to common paving, sealcoating, Belgium block, and maintenance questions from MAC Paving and Sealcoating LLC in North Jersey.",Frequently Asked Questions,153,Service areas → `/service-areas/` | Contact page → `/contact/` | Driveway paving overview → `/services/driveway-paving-nj/`,Expand Q/A set over time using search console query data for richer coverage.
Gallery,/gallery/,Paving & Stone Border Project Gallery | MAC Paving,"Browse recent driveway paving, sealcoating, Belgium-block, and edging projects completed by MAC Paving and Sealcoating LLC across North Jersey.",Recent Paving & Edging Projects,113,Driveway paving overview → `/services/driveway-paving-nj/` | Belgium block borders → `/services/belgium-blocks/` | Sealcoating services → `/services/sealer/sealcoating/` | Contact page → `/contact/`,Optimize image sizes and lazy loading to maintain Core Web Vitals.
